,0,1,2,3
0,2020-07-30 18:43:22,83.71014492753623,magic square./people/solution./magic square/haskell, Aims to rewrite vim modeling emacs architecture best worlds. try emacs. use sublime text. use vim internals emacs better. use Vim plugin ecosystem long. mean user friendly. omg think try emac. good ideas modal editing. try try magic square. magic square problem. It's probably hard right. onlu literarily know brute force solution. guess libra project written rust .
1,2020-08-09 22:00:44,80.3360655737705,lightskinned european ancestry/thats/maybe/yeah/european/asians/brown jesus, The data site tells academic studies particular gene variants . The takeaways are apoe33 neutral dementia apoe2 good apoe4 bad and apoe3 common neutral . The best version known longevity gene foxo3 greatly improves odds living improve insulin sensitivity reduce oxidative stress things .
2,2020-07-29 15:58:58,62.82692307692307,bought worth nickles./home depot/maybe/tim cook/google/thailand/kyle bass, Think tim cook answered mins question past hours past hours. think tim apple raised fee initially set. occasionally discounts large app developers . think user bases similar size ios users average richer willing pay apps. Arugment tim apple raises fees initially set . Think lost home depot looks raised significant round acquired company seems startup merger ultimately became got rolled . Think about Google's algorithmically curating search results . Think andriod. most company afford survive app android. think . think about the cost of the app store .
3,2020-08-09 14:14:56,60.0625,north african/native american/years ago./north african/american, Mom thinks ancestors from mostly german british. There little bit southern european eastern europeans. looked claims native american potentially mislead harvard medical school according articles. looked at claims native American . looked claims to have misled harvard . medical school . mom thinks ancestors are mostly from north african andor east asian eg middle east. middle east europe. eg middle. east east. west asian .
4,2020-07-22 17:53:18,58.18181818181819,play money/poker site/yeah online/online casino/pokerstars/elon, Poker is illegal in the U.S. and illegal in offshore gambling but popular in the UK . The site has been bought by pokerstars for $5.5 billion . Pokerstars bought the site for $1.5 million .
5,2020-06-25 16:15:58,55.55905511811024,think/yeah/maybe/article says/stanless steel/asian/stanless/google, kristy got here far good. cut vegetables but im optimistic. gonna cook. this looks totoally pandemic game played. yelp says restuarants closed closed closed permanently. ymg this story amazing too bad restaurants dead but restaurants die there. yolp says restaurants closed closed. omg this is embarrassing managed achieve achieve achieve response destroys economy fails stop virus. this seems to be a pandemic. how bad is it. how is italian mafia fratboy style. how does it Italian mafia get people to approach couple by way its ebay you behave . how thing cost end. how things cost
6,2020-07-08 18:35:08,49.44117647058823,pet scan/track progress./yeah/alzheimers./neuropsych/european/ftd/apoe, Aducanumab failed phase trial followup smaller subset took higher dose effect. trying approval basis. bit sketchy but its better. well its better alzheimers. exercise socialization thing know help. going cure best case slows progression people. hope to hear fda soon.
7,2020-08-07 10:00:32,41.93975903614458,sarah palin/people/stupid. yeah/aoc bernie/china/amazon/aoc, Says black hit upper manhattan 5am. 5am 5am didnt blackout. probably speculator texas buys juice. Maybe grid issue infrastructure issue. Maybe speculators texas buy juice. remember traders enron causing blackouts california. did blackout night. says hotels located upper west. say hotels located. wonder rest. rest. im guessing trump hotels. Its actually kinda fitting. The hotels cost hundreds dollars night city city paying it wonder unrecoverable deficit. The city is paying it for the millions of dollars a night to participate in the program .
8,2020-08-03 17:25:07,40.33333333333333,got/manhattan, Wahoo basically considered best indoor bike stuff. sooo high tech skepitcal works advertised. think athletes train kickr product. want road bike accident accident. agree indoor safer. think place nyc crazy bike. palisades. huh sounded good true though . i surprised gone crazy. i got endless books read lots customers recommend different things reading  met anthony scaramucci know guy then recommended books realize book realize book. I got free candies free time read books bad job. I think night time doorman best job.
9,2020-07-23 12:16:30,36.125,object oriented matlab./ray tracer/attached paper/matlab/google/ray tracer, Hilarious job shaw website. interested in. asking writing sample. attached paper published old boss. like author attached paper wrote college. words. like looking sample couple pages long. couple pages longer nontechnical explorative. apply editor job. Apply editor job job. want google stock. want capital gains. maybe forever gift grandkids occasionally tax exemption. Want capital gains . Want to write ray tracer now. Want to play poker .
10,2020-06-07 12:26:36,34.72222222222222,park ave/pay subscription./haha think/starbucks coffee/pelaton/starbucks/park ave, Bike app. pay subscription. month free subscription pelaton class. month . try survive holding tough position lady welcome xxxyyy zzz hgfdh fhdgo seconds. try survive hold tough position . try fast 20seocnds intervals. try fast. 20s. mins. intervals. interval length varies called tabata short interval. tried. tried hard. try hard. play music count. push harder .
11,2020-07-06 14:46:26,33.23076923076923,good advice/agree/thats, Driving school opened today in New York City . Driving lession low risk event right. It's easy drive now there traffic. There traffic. Heh think sort charts disingenuous. but agree conclusion demand commodities increase.
12,2020-06-04 11:14:42,32.924050632911396,mapo tofu./yeah/maybe/pork/mapo, A coworker taking celebrate kids birthday two exactly years apart birthday such brilliant planning. old people booking. lots money want adventure managing trip logistics hard. noreeigian cruise anartica. think mum want cruise. year. think matters solvency. demand clearly. huhyeah. Heh bet cold. know caribean says booking par. understand it cruise attracts people. personally feel death trap clearly minoroity. stock havent moved. yeah it think makes sense old people. I'm not sure why I'm going to go to rockaways tomorrow probably going rain saturday maybe wait week. Maybe add mushroom mushroom.
